[
  {
    "id": "2dbae4ca46",
    "title": "Fulbright-Nehru Doctoral Research Fellowship",
    "agency": "Fulbright-Nehru",
    "country": "International",
    "grant_type": "Fellowship",
    "amount": "Full support (stipend, housing, travel)",
    "description": "6–9 months dissertation research in the United States. Priority: AI, energy, space science, defense.",
    "url": "https://www.usief.org.in/Fellowships.aspx",
    "deadline": "2026-07-01",
    "open_date": null,
    "eligibility": [
      "PhD Student (registered in India)"
    ],
    "disciplines": [
      "AI/ML",
      "Energy",
      "Space Science",
      "Defense",
      "Any"
    ],
    "status": "open",
    "last_updated": "2026-07-01"
  },
  {
    "id": "a7cdbb55f9",
    "title": "BIRAC Biotechnology Ignition Grant (BIG)",
    "agency": "BIRAC",
    "country": "India",
    "grant_type": "Startup Grant",
    "amount": "Up to ₹50 Lakhs (18 months)",
    "description": "Flagship early-stage biotech funding. Up to ₹50L for proof-of-concept. Opens TWICE yearly: Jan 1 and Jul 1. Largest early-stage biotech funding programme in India.",
    "url": "https://birac.nic.in/big.php",
    "deadline": "2026-07-01",
    "open_date": "2026-07-01",
    "eligibility": [
      "Startup",
      "Individual Innovator",
      "Faculty Entrepreneur"
    ],
    "disciplines": [
      "Biotechnology",
      "MedTech",
      "AgriTech",
      "Biopharma"
    ],
    "status": "open",
    "last_updated": "2026-07-01"
  },
  {
    "id": "1eff94a553",
    "title": "Fulbright-Nehru Postdoctoral Research Fellowship",
    "agency": "Fulbright-Nehru",
    "country": "International",
    "grant_type": "Fellowship",
    "amount": "Living allowance + travel + health insurance",
    "description": "8–24 months at a US institution. For Indian early career researchers in science, technology, and innovation fields.",
    "url": "https://www.usief.org.in/Fellowships.aspx",
    "deadline": "2026-07-15",
    "open_date": null,
    "eligibility": [
      "Early Career Researcher",
      "PhD Holder (≤5 years)"
    ],
    "disciplines": [
      "Science",
      "Technology",
      "Public Policy",
      "Any"
    ],
    "status": "open",
    "last_updated": "2026-07-01"
  },
  {
    "id": "c6c6ffc0d7",
    "title": "ANRF National Science Chair (NSC) 2026",
    "agency": "ANRF",
    "country": "India",
    "grant_type": "Fellowship",
    "amount": "TBA",
    "description": "Prestigious chair for exceptional senior researchers. Jul 2026.",
    "url": "https://anrfonline.in/",
    "deadline": "2026-07-31",
    "open_date": "2026-07-01",
    "eligibility": [
      "Senior Researcher",
      "Professor"
    ],
    "disciplines": [
      "Any"
    ],
    "status": "open",
    "last_updated": "2026-07-01"
  },
  {
    "id": "db9f6f7175",
    "title": "ANRF Inclusivity Research Grant (IRG) 2026 — New Scheme",
    "agency": "ANRF",
    "country": "India",
    "grant_type": "Research Grant",
    "amount": "TBA",
    "description": "New ANRF scheme 2026. Promotes research inclusion. Oct 1–Nov 3 2026.",
    "url": "https://anrfonline.in/",
    "deadline": "2026-11-03",
    "open_date": "2026-10-01",
    "eligibility": [
      "Faculty",
      "Researcher",
      "Indian Institution"
    ],
    "disciplines": [
      "Any"
    ],
    "status": "open",
    "last_updated": "2026-07-01"
  },
  {
    "id": "ebeea1e700",
    "title": "EMBL Predoctoral Fellowship (PhD Programme)",
    "agency": "EMBL",
    "country": "International",
    "grant_type": "Fellowship",
    "amount": "Full stipend + benefits",
    "description": "Fully funded PhD positions at EMBL sites across Europe. Annual intake. Indian applicants eligible and encouraged.",
    "url": "https://www.embl.org/about/info/international-phd-programme/",
    "deadline": "2026-11-15",
    "open_date": null,
    "eligibility": [
      "MSc Graduate",
      "BTech Graduate (Research experience)"
    ],
    "disciplines": [
      "Computational Biology",
      "Genomics",
      "Structural Biology",
      "Cell Biology"
    ],
    "status": "open",
    "last_updated": "2026-07-01"
  },
  {
    "id": "10c7db5722",
    "title": "ANRF Prime Minister Early Career Research Grant (PM-ECRG) 2026",
    "agency": "ANRF",
    "country": "India",
    "grant_type": "Research Grant",
    "amount": "₹60 Lakhs + overheads (3 years)",
    "description": "One-time career grant for early-career faculty. Subsumes erstwhile SRG. ₹60L + overheads for 3 years. Max 700 grants/year.",
    "url": "https://anrfonline.in/ANRF/ecrg_anrf",
    "deadline": "2026-12-02",
    "open_date": "2026-11-02",
    "eligibility": [
      "Early Career Faculty",
      "Indian Institution"
    ],
    "disciplines": [
      "Science",
      "Engineering",
      "Technology"
    ],
    "status": "open",
    "last_updated": "2026-07-01"
  },
  {
    "id": "72b93ecd8e",
    "title": "ANRF Ramanujan Fellowship 2026",
    "agency": "ANRF",
    "country": "India",
    "grant_type": "Fellowship",
    "amount": "₹1,35,000/month + research grant (5 years)",
    "description": "For exceptional Indian scientists returning from abroad. Open throughout 2026. Decisions announced twice yearly.",
    "url": "https://anrfonline.in/ANRF/Ramanujan_fellowship",
    "deadline": "2026-12-31",
    "open_date": "2026-01-01",
    "eligibility": [
      "Indian Scientist (Overseas/Diaspora)"
    ],
    "disciplines": [
      "Science",
      "Engineering"
    ],
    "status": "open",
    "last_updated": "2026-07-01"
  },
  {
    "id": "csir-symp001",
    "title": "CSIR Symposia/Conference Grant",
    "agency": "CSIR",
    "country": "India",
    "grant_type": "Conference Grant",
    "amount": "Up to ₹2 Lakhs",
    "description": "Supports organization of national/international conferences and symposia at Indian institutions.",
    "url": "https://www.csir.res.in/funding",
    "deadline": null,
    "open_date": null,
    "eligibility": [
      "Faculty",
      "Researcher",
      "Indian Institution"
    ],
    "disciplines": [
      "Any"
    ],
    "status": "open",
    "last_updated": "2026-03-14"
  },
  {
    "id": "wellcome-ia001",
    "title": "Wellcome India Alliance — Intermediate Fellowship",
    "agency": "Wellcome DBT India Alliance",
    "country": "International",
    "grant_type": "Fellowship",
    "amount": "Up to ₹3.25 Crores (5 years)",
    "description": "For Indian researchers with a strong track record seeking independence. Covers salary, research costs, training.",
    "url": "https://indiaalliance.org/apply-for-a-grant/intermediate-fellowship",
    "deadline": null,
    "open_date": null,
    "eligibility": [
      "Early Career Researcher",
      "Faculty"
    ],
    "disciplines": [
      "Biomedical",
      "Life Sciences",
      "Public Health"
    ],
    "status": "open",
    "last_updated": "2026-03-14"
  },
  {
    "id": "embo-ig001",
    "title": "EMBO Installation Grant",
    "agency": "EMBO",
    "country": "International",
    "grant_type": "Installation Grant",
    "amount": "€50,000/year (up to 5 years)",
    "description": "Supports researchers returning to or establishing labs in EMBC member states and associate member countries including India.",
    "url": "https://www.embo.org/funding-awards/installation-grants/",
    "deadline": null,
    "open_date": null,
    "eligibility": [
      "Early Career Researcher",
      "Faculty"
    ],
    "disciplines": [
      "Life Sciences",
      "Molecular Biology"
    ],
    "status": "open",
    "last_updated": "2026-03-14"
  },
  {
    "id": "gates-gc001",
    "title": "Grand Challenges Explorations — Open Call",
    "agency": "Gates Foundation",
    "country": "International",
    "grant_type": "Grand Challenge",
    "amount": "USD 100,000 (Phase 1)",
    "description": "Supports bold ideas in global health and development. India-based researchers strongly encouraged.",
    "url": "https://gcgh.grandchallenges.org/challenges",
    "deadline": null,
    "open_date": null,
    "eligibility": [
      "Researcher",
      "Faculty",
      "NGO",
      "Institution"
    ],
    "disciplines": [
      "Global Health",
      "Agriculture",
      "Vaccines",
      "Nutrition"
    ],
    "status": "open",
    "last_updated": "2026-03-14"
  },
  {
    "id": "iusstf-001",
    "title": "IUSSTF Indo-US Joint Research Program",
    "agency": "IUSSTF",
    "country": "International",
    "grant_type": "Collaborative Grant",
    "amount": "USD 60,000 (US side) + INR equivalent (India side)",
    "description": "Joint research grants for Indian and US researchers. Covers exchanges, workshops, and collaborative projects.",
    "url": "https://www.iusstf.org/program/joint-research-projects",
    "deadline": null,
    "open_date": null,
    "eligibility": [
      "Faculty",
      "Researcher"
    ],
    "disciplines": [
      "Science",
      "Technology",
      "Engineering"
    ],
    "status": "open",
    "last_updated": "2026-03-14"
  },
  {
    "id": "par-amr2026",
    "title": "PAR Foundation 2026 Grant — Beyond Antibiotics",
    "agency": "PAR Foundation",
    "country": "International",
    "grant_type": "Research Grant",
    "amount": "Varies (project-based)",
    "description": "2026 theme: 'Beyond Antibiotics: Preventive Strategies That Lower the Need for Antibiotic Use.' Supports research reducing infection risk and improving antimicrobial stewardship. Global applicants welcome including India.",
    "url": "https://opencalls.parfoundation.org/",
    "deadline": null,
    "open_date": null,
    "eligibility": [
      "Researcher",
      "Faculty",
      "Institution",
      "NGO"
    ],
    "disciplines": [
      "AMR",
      "Infectious Disease",
      "Public Health",
      "Microbiology",
      "One Health"
    ],
    "status": "open",
    "last_updated": "2026-03-14"
  },
  {
    "id": "google-india-ra001",
    "title": "Google India Research Award",
    "agency": "Google Research",
    "country": "International",